{
  "$schema": "https://json-schema.org/draft/2020-12/schema",
  "$id": "rules.schema.json",
  "title": "rules.json (D10)",
  "type": "object",
  "required": [
    "schema_version",
    "updated_at",
    "source_doc",
    "rules"
  ],
  "properties": {
    "schema_version": {
      "const": 1
    },
    "updated_at": {
      "type": "string"
    },
    "source_doc": {
      "type": "string"
    },
    "rules": {
      "type": "object",
      "additionalProperties": false,
      "required": [
        "starting_balance_usd",
        "daily_loss_cap_usd",
        "max_drawdown_usd",
        "max_contracts",
        "micro_to_standard_ratio",
        "flatten_time_ct",
        "hold_margin_multipliers",
        "margin_basis",
        "allowed_roots",
        "challenge_start_date",
        "challenge_end_date"
      ],
      "properties": {
        "starting_balance_usd": {
          "type": "object",
          "required": [
            "value",
            "source"
          ],
          "properties": {
            "value": {
              "type": [
                "number",
                "null"
              ],
              "exclusiveMinimum": 0
            },
            "source": {
              "type": [
                "string",
                "null"
              ]
            },
            "note": {
              "type": "string"
            },
            "applies": {
              "type": "boolean"
            }
          }
        },
        "daily_loss_cap_usd": {
          "type": "object",
          "required": [
            "value",
            "source"
          ],
          "properties": {
            "value": {
              "type": [
                "number",
                "null"
              ],
              "exclusiveMinimum": 0
            },
            "source": {
              "type": [
                "string",
                "null"
              ]
            },
            "note": {
              "type": "string"
            },
            "applies": {
              "type": "boolean"
            }
          }
        },
        "max_drawdown_usd": {
          "type": "object",
          "required": [
            "value",
            "source"
          ],
          "properties": {
            "value": {
              "type": [
                "number",
                "null"
              ],
              "exclusiveMinimum": 0
            },
            "source": {
              "type": [
                "string",
                "null"
              ]
            },
            "note": {
              "type": "string"
            },
            "applies": {
              "type": "boolean"
            }
          }
        },
        "max_contracts": {
          "type": "object",
          "required": [
            "value",
            "source"
          ],
          "properties": {
            "value": {
              "type": [
                "integer",
                "null"
              ],
              "minimum": 1
            },
            "source": {
              "type": [
                "string",
                "null"
              ]
            },
            "note": {
              "type": "string"
            },
            "applies": {
              "type": "boolean"
            }
          }
        },
        "micro_to_standard_ratio": {
          "type": "object",
          "required": [
            "value",
            "source"
          ],
          "properties": {
            "value": {
              "type": [
                "number",
                "null"
              ],
              "exclusiveMinimum": 0
            },
            "source": {
              "type": [
                "string",
                "null"
              ]
            },
            "note": {
              "type": "string"
            },
            "applies": {
              "type": "boolean"
            }
          }
        },
        "flatten_time_ct": {
          "type": "object",
          "required": [
            "value",
            "source"
          ],
          "properties": {
            "value": {
              "type": [
                "string",
                "null"
              ],
              "pattern": "^([01]\\d|2[0-3]):[0-5]\\d$"
            },
            "source": {
              "type": [
                "string",
                "null"
              ]
            },
            "note": {
              "type": "string"
            },
            "applies": {
              "type": "boolean"
            }
          }
        },
        "hold_margin_multipliers": {
          "type": "object",
          "required": [
            "value",
            "source"
          ],
          "properties": {
            "value": {
              "oneOf": [
                {
                  "type": "null"
                },
                {
                  "type": "object",
                  "additionalProperties": false,
                  "required": [
                    "intraday",
                    "overnight",
                    "weekend"
                  ],
                  "properties": {
                    "intraday": {
                      "type": [
                        "number",
                        "null"
                      ]
                    },
                    "overnight": {
                      "type": [
                        "number",
                        "null"
                      ]
                    },
                    "weekend": {
                      "type": [
                        "number",
                        "null"
                      ]
                    }
                  }
                }
              ]
            },
            "source": {
              "type": [
                "string",
                "null"
              ]
            },
            "note": {
              "type": "string"
            },
            "applies": {
              "type": "boolean"
            }
          }
        },
        "margin_basis": {
          "type": "object",
          "required": [
            "value",
            "source"
          ],
          "properties": {
            "value": {
              "enum": [
                "initial",
                "maintenance",
                null
              ]
            },
            "source": {
              "type": [
                "string",
                "null"
              ]
            },
            "note": {
              "type": "string"
            },
            "applies": {
              "type": "boolean"
            }
          }
        },
        "allowed_roots": {
          "type": "object",
          "required": [
            "value",
            "source"
          ],
          "properties": {
            "value": {
              "type": [
                "array",
                "null"
              ],
              "items": {
                "type": "string",
                "pattern": "^[A-Z0-9]{1,4}$"
              }
            },
            "source": {
              "type": [
                "string",
                "null"
              ]
            },
            "note": {
              "type": "string"
            },
            "applies": {
              "type": "boolean"
            }
          }
        },
        "challenge_start_date": {
          "type": "object",
          "required": [
            "value",
            "source"
          ],
          "properties": {
            "value": {
              "type": [
                "string",
                "null"
              ]
            },
            "source": {
              "type": [
                "string",
                "null"
              ]
            },
            "note": {
              "type": "string"
            },
            "applies": {
              "type": "boolean"
            }
          }
        },
        "challenge_end_date": {
          "type": "object",
          "required": [
            "value",
            "source"
          ],
          "properties": {
            "value": {
              "type": [
                "string",
                "null"
              ]
            },
            "source": {
              "type": [
                "string",
                "null"
              ]
            },
            "note": {
              "type": "string"
            },
            "applies": {
              "type": "boolean"
            }
          }
        },
        "daily_loss_cap_pct": {
          "type": "object",
          "required": [
            "value",
            "source"
          ],
          "properties": {
            "value": {
              "type": [
                "number",
                "null"
              ],
              "exclusiveMinimum": 0,
              "maximum": 1
            },
            "source": {
              "type": [
                "string",
                "null"
              ]
            },
            "note": {
              "type": "string"
            },
            "applies": {
              "type": "boolean"
            }
          }
        },
        "flatten_dates": {
          "type": "object",
          "required": [
            "value",
            "source"
          ],
          "properties": {
            "value": {
              "type": [
                "array",
                "null"
              ],
              "items": {
                "type": "string",
                "pattern": "^\\d{4}-\\d{2}-\\d{2}$"
              }
            },
            "source": {
              "type": [
                "string",
                "null"
              ]
            },
            "note": {
              "type": "string"
            },
            "applies": {
              "type": "boolean"
            }
          }
        },
        "min_contracts_per_day": {
          "type": "object",
          "required": [
            "value",
            "source"
          ],
          "properties": {
            "value": {
              "type": [
                "integer",
                "null"
              ],
              "minimum": 0
            },
            "source": {
              "type": [
                "string",
                "null"
              ]
            },
            "note": {
              "type": "string"
            },
            "applies": {
              "type": "boolean"
            }
          }
        },
        "commission_per_side_usd": {
          "type": "object",
          "required": [
            "value",
            "source"
          ],
          "properties": {
            "value": {
              "type": [
                "number",
                "null"
              ],
              "minimum": 0
            },
            "source": {
              "type": [
                "string",
                "null"
              ]
            },
            "note": {
              "type": "string"
            },
            "applies": {
              "type": "boolean"
            }
          }
        }
      }
    }
  }
}
